{"agent_id":"qa-kernel-trace-compiler","created_utc":"2026-06-19T00:00:00Z","generator":"lean_kernel_execution","input_hash":"06c09027e847b848abbb2286cd60e0d5fa1dd433be01a40b8d62b44298843dae","invariant_diff":{"case_id":"ex19_imp_trans","execution_sha256":"577bf7ff176adb2ee9a23cf695e8b311e0264e7675bd64c318972f78d4a6c5fe","expected_status":"SUCCESS","kernel_derived":true,"proof_method":"function_application","source_sha256":"70dc150308a41ddda964f44f0e0d5902dfb41bf4c416b0a5b2d4c215b96635f2"},"merkle_parent":"e1e50b48c259296d4ac2fdb31b6cc6cb02760cbcf6b161add5fa319b481d82ab","output_hash":"70dc150308a41ddda964f44f0e0d5902dfb41bf4c416b0a5b2d4c215b96635f2","result":{"status":"SUCCESS","witness_hash":"577bf7ff176adb2ee9a23cf695e8b311e0264e7675bd64c318972f78d4a6c5fe"},"schema_id":"QA_MATH_COMPILER_TRACE_SCHEMA.v1","source_layer":"human","target_layer":"formal","toolchain_id":"lean4.31.0","trace_id":"0802269552c24d7ec9c0a1c960c489e1146f275395a2ebcb7400892b43293577"}
