{"agent_id":"qa-kernel-trace-compiler","created_utc":"2026-06-19T00:00:00Z","generator":"lean_kernel_execution","input_hash":"f16d3305f1a21a32bc5eab8c663a3830c957da91e4db6c10e8dfa5e8f7cc751b","invariant_diff":{"case_id":"ex33_contraposition","elaboration_trace_sha256":"d1e5b9aea341d1e703d71d8e9896f9494d05cc3288608040b7d8c1b00d4e1c7b","execution_sha256":"047f7604e63c4e5f5c1b63208a98a1d17a4b99ff35439752fb14c319adca6793","expected_status":"SUCCESS","kernel_derived":true,"proof_method":"function_application","proof_step_count":4,"source_sha256":"91626db2a2385f2e39d9d697670ef5b7a028919bdb0afe0b6c69ccc9bc2f4892"},"merkle_parent":"a247c8d620fdd1a72fb362613c105d5c84ea64a530c477b7a6be87bfc3ccfdfd","output_hash":"91626db2a2385f2e39d9d697670ef5b7a028919bdb0afe0b6c69ccc9bc2f4892","result":{"status":"SUCCESS","witness_hash":"047f7604e63c4e5f5c1b63208a98a1d17a4b99ff35439752fb14c319adca6793"},"schema_id":"QA_MATH_COMPILER_TRACE_SCHEMA.v1","source_layer":"human","target_layer":"formal","toolchain_id":"lean4.31.0","trace_id":"ebf685002a4e6c0eb6554ce5be83bcb119cdd0d143ad5198c13128585b6407db"}
