{"agent_id":"qa-kernel-trace-compiler","created_utc":"2026-06-19T00:00:00Z","generator":"lean_kernel_execution","input_hash":"3e2e2dbf33531ad3dc9de214a42753edf95bde173c6b39f44fe4345538a49630","invariant_diff":{"case_id":"ex27_or_assoc","execution_sha256":"4f3f8f07c1e072b5254dc2bd63d8a6ab0f297f7a3a8bb060f1db361985f6dc21","expected_status":"SUCCESS","kernel_derived":true,"proof_method":"Or.inl;Or.inr","source_sha256":"9c7e4d6ab5f3932ea75e506793ca894a60be9aff949d003e7598a402febaa688"},"merkle_parent":"e1e50b48c259296d4ac2fdb31b6cc6cb02760cbcf6b161add5fa319b481d82ab","output_hash":"9c7e4d6ab5f3932ea75e506793ca894a60be9aff949d003e7598a402febaa688","result":{"status":"SUCCESS","witness_hash":"4f3f8f07c1e072b5254dc2bd63d8a6ab0f297f7a3a8bb060f1db361985f6dc21"},"schema_id":"QA_MATH_COMPILER_TRACE_SCHEMA.v1","source_layer":"human","target_layer":"formal","toolchain_id":"lean4.31.0","trace_id":"23923d9b4218a285628bd706660e748aa5deabe7a286713dd3179cdaf28e2d5c"}
