{"agent_id":"qa-kernel-trace-compiler","created_utc":"2026-06-19T00:00:00Z","generator":"lean_kernel_execution","input_hash":"5d44ca938cd677b5656a4f88b9acadb63db66978a2fa3eb3c3e741ccf6bf9487","invariant_diff":{"case_id":"mathlib24_factorial_pos","dependency_lock_sha256":"57861ce4045ac552c23d7559ed62427b3b75fe1ff37bb7d79e2ca81a84642596","elaboration_trace_sha256":"22240ec9cd444f8dfb8b235ada644af3e7833945fbd0ca595e484a80e650fddd","execution_sha256":"ed08633fe7c7649150659dfa770ed80ca003d237719d22a7ce44f668ccd938c3","expected_status":"SUCCESS","kernel_derived":true,"proof_method":"Nat.factorial_pos","proof_step_count":1,"source_sha256":"f8fa3a044021c7fc84ccd8fb6deb042f2ea1e647797093f5072c59c8319f519f","upstream_declaration":"Nat.factorial_pos"},"merkle_parent":"a247c8d620fdd1a72fb362613c105d5c84ea64a530c477b7a6be87bfc3ccfdfd","output_hash":"f8fa3a044021c7fc84ccd8fb6deb042f2ea1e647797093f5072c59c8319f519f","result":{"status":"SUCCESS","witness_hash":"ed08633fe7c7649150659dfa770ed80ca003d237719d22a7ce44f668ccd938c3"},"schema_id":"QA_MATH_COMPILER_TRACE_SCHEMA.v1","source_layer":"human","target_layer":"formal","toolchain_id":"lean4.31.0","trace_id":"3202d267d2b714722c6f6c800f823f9934e5b3960fe66bfb03fe5546c30f5d96"}
