{
  "agent_id": "qa-kernel-trace-compiler",
  "created_utc": "2026-06-22T00:00:00Z",
  "generator": "lean_kernel_execution",
  "input_hash": "334ae329eed0ddf60f8a03bbfea516b02c632cede8a5491587d9c5b161b0718c",
  "invariant_diff": {
    "case_id": "qa_orbit41_fib_vec_periodic",
    "dependency_lock_sha256": "57861ce4045ac552c23d7559ed62427b3b75fe1ff37bb7d79e2ca81a84642596",
    "elaboration_trace_sha256": "354c1c333d94d4c1c5ebd7832ddedfb58b2397b935eb86f24ae7c03090205b2f",
    "execution_sha256": "9ffe88939e94685e5ec87779ceddfa1123f5c0ae15399c01c9b65971b3733cd1",
    "expected_status": "SUCCESS",
    "kernel_derived": true,
    "proof_method": "rw",
    "proof_step_count": 1,
    "source_sha256": "7b95eb38380ecc3368440bb9262c4a9c19362cff43462e5bca76ed03ba069b8c"
  },
  "merkle_parent": "c81cd1875e0631c715191e249d41c0b621a8794d1d5b3733eb79d3983a698ecd",
  "output_hash": "7b95eb38380ecc3368440bb9262c4a9c19362cff43462e5bca76ed03ba069b8c",
  "result": {
    "status": "SUCCESS",
    "witness_hash": "9ffe88939e94685e5ec87779ceddfa1123f5c0ae15399c01c9b65971b3733cd1"
  },
  "schema_id": "QA_MATH_COMPILER_TRACE_SCHEMA.v1",
  "source_layer": "human",
  "target_layer": "formal",
  "toolchain_id": "lean4.31.0",
  "trace_id": "c632c706210b4b205ff13bc676af486ff8cd2ef6d6228b95a5c15f480c81305b"
}