{"agent_id":"qa-kernel-trace-compiler","created_utc":"2026-06-19T00:00:00Z","generator":"lean_kernel_execution","input_hash":"14e0e58bb3409540b9d24824bdd770be682ba89338e0b20a878d6f605722e63b","invariant_diff":{"case_id":"ex11_zero_mul","elaboration_trace_sha256":"ef82e64364460d8434c6f0c2fa8a5187a404c4e72062b232b2aed13a126034b3","execution_sha256":"468b945aed74254db203d861b396dd037253ad373d94156c3f230c35c805c74f","expected_status":"SUCCESS","kernel_derived":true,"proof_method":"Nat.zero_mul","proof_step_count":0,"source_sha256":"4f9018a9602fc741a6551b25c062faa9e41b3d43744cc3a54d1e522ca746a72f"},"merkle_parent":"a247c8d620fdd1a72fb362613c105d5c84ea64a530c477b7a6be87bfc3ccfdfd","output_hash":"4f9018a9602fc741a6551b25c062faa9e41b3d43744cc3a54d1e522ca746a72f","result":{"status":"SUCCESS","witness_hash":"468b945aed74254db203d861b396dd037253ad373d94156c3f230c35c805c74f"},"schema_id":"QA_MATH_COMPILER_TRACE_SCHEMA.v1","source_layer":"human","target_layer":"formal","toolchain_id":"lean4.31.0","trace_id":"cf77b9fc2c1c430b0ff9bf80ef5c43bdb0e701716ee6e4727f2a14415af56c80"}
