{"agent_id":"qa-kernel-trace-compiler","created_utc":"2026-06-19T00:00:00Z","generator":"lean_kernel_execution","input_hash":"57cdcfc7230fd4f05f6547eb54f5aaaf8f6e071a46904f07b726af0673439a51","invariant_diff":{"case_id":"ex25_exists_self","execution_sha256":"69b4bb1c059f0b719c6e2fa8efd7cf0ddb0bbcbd45c7737cc2b4cc8eeb0ac8b0","expected_status":"SUCCESS","kernel_derived":true,"proof_method":"Exists.intro","source_sha256":"9efc3b22976db966bd52bf2ee320d7b7232475c659d12cd3571d9a50bcad29b6"},"merkle_parent":"e1e50b48c259296d4ac2fdb31b6cc6cb02760cbcf6b161add5fa319b481d82ab","output_hash":"9efc3b22976db966bd52bf2ee320d7b7232475c659d12cd3571d9a50bcad29b6","result":{"status":"SUCCESS","witness_hash":"69b4bb1c059f0b719c6e2fa8efd7cf0ddb0bbcbd45c7737cc2b4cc8eeb0ac8b0"},"schema_id":"QA_MATH_COMPILER_TRACE_SCHEMA.v1","source_layer":"human","target_layer":"formal","toolchain_id":"lean4.31.0","trace_id":"e85c1f69051335b1cc998d084c6ec49b9985cb6752d503c2d35fdfec6dc1b2b3"}
