{"agent_id":"qa-kernel-trace-compiler","created_utc":"2026-06-19T00:00:00Z","generator":"lean_kernel_execution","input_hash":"66159fc2a400e43309d5e711e4b27af7527babc353a37b17f8b095bdd61f06bb","invariant_diff":{"case_id":"ex35_comp_assoc","elaboration_trace_sha256":"26b31889f34d13c2a52a391640d5473a4d10b84e1a8847e7c787ade955076820","execution_sha256":"f299c4e869ee88dffac302dd354582c682aa9ba9aa5cb710b617cc017fcfc2ab","expected_status":"SUCCESS","kernel_derived":true,"proof_method":"rfl","proof_step_count":0,"source_sha256":"600d136d94b065c9e06cc3fb842d85560728d327d867cf8219e8ec9828b258c3"},"merkle_parent":"a247c8d620fdd1a72fb362613c105d5c84ea64a530c477b7a6be87bfc3ccfdfd","output_hash":"600d136d94b065c9e06cc3fb842d85560728d327d867cf8219e8ec9828b258c3","result":{"status":"SUCCESS","witness_hash":"f299c4e869ee88dffac302dd354582c682aa9ba9aa5cb710b617cc017fcfc2ab"},"schema_id":"QA_MATH_COMPILER_TRACE_SCHEMA.v1","source_layer":"human","target_layer":"formal","toolchain_id":"lean4.31.0","trace_id":"071f6904a9c2e20c96a4afe75d89d975ca4d737f53ed2bbfc1283a62e7cff63b"}
