{"agent_id":"qa-kernel-trace-compiler","created_utc":"2026-06-19T00:00:00Z","generator":"lean_kernel_execution","input_hash":"6a4b5a9d2c7e3d72f9376e9da9113b6ee51cc311dd9b128611b724783dd95791","invariant_diff":{"case_id":"mathlib30_finset_card_singleton","dependency_lock_sha256":"57861ce4045ac552c23d7559ed62427b3b75fe1ff37bb7d79e2ca81a84642596","elaboration_trace_sha256":"76ab635ac699b6823c7094844cfc9a53bb08d4c564e5394de01f8090131c87ca","execution_sha256":"aa54be30df7ba53c949fafc8a174282880b8bfa5acf798af9500dde3b8128125","expected_status":"SUCCESS","kernel_derived":true,"proof_method":"Finset.card_singleton","proof_step_count":1,"source_sha256":"a78a92a3c9795926d661dadb1881ee179acc541c3d0eabb995b85c65861cdf08","upstream_declaration":"Finset.card_singleton"},"merkle_parent":"a247c8d620fdd1a72fb362613c105d5c84ea64a530c477b7a6be87bfc3ccfdfd","output_hash":"a78a92a3c9795926d661dadb1881ee179acc541c3d0eabb995b85c65861cdf08","result":{"status":"SUCCESS","witness_hash":"aa54be30df7ba53c949fafc8a174282880b8bfa5acf798af9500dde3b8128125"},"schema_id":"QA_MATH_COMPILER_TRACE_SCHEMA.v1","source_layer":"human","target_layer":"formal","toolchain_id":"lean4.31.0","trace_id":"5d725b84706be61a7297d7b3b7594e6806963205afdf3d2be43896a6260280ad"}
